text,identifier
之船我已修理兹有寄和〡〧〨〤年又和荷蘭〡〧〨〥年之數可查對回息來吧 兹寄去茶貳箱可收入矣 以便向高羅山高籟官二人理會清算去年之數我該坐來錢叁 千文候明年清還又爾之男僕二口不慣船務我留在吧使唤 從時並伊妻林慈娘掛沙往萬蘭然林慈娘係女兒之母姨故 相投非惟我自己屢求暨我親朋戚友苦勸終不肯聽是無愛 賢妻我所深愛之人所不解者執拗而不聽人言其情似與我不 托他率女回吧可將女兒並其囝仔物件交他帶來爾所整發 我之心矣想爾現有可依怙未知將來如何我今有做字付 王,01_11_0007_p007_r_12
13,01_11_0007_p007_r_3
雷珍蘭高根官和〡〧〨〥年十月廿五日寄往萬蘭書云,01_11_0007_p007_r_9
掛沙人須換其名字六在吧兒曹可寄回家交母親撫養七黄志娘萬 高榮叠各照原價承坐五女兒三人高意娘高添娘高變娘等平時 所收税錢之厝若有意愛亦可照價承坐以上凡有得地限六個月 蘭人我死後不許他入我家門並管我家人八掛沙人雷珍蘭王珠,01_11_0007_p007_r
所生高添娘年十八歲係故妻李蔭娘所生高變娘年十五歲係妻 至於充入祠堂之錢及建宅之錢亦可向母親取出四洪溪酒灶付高 陳審娘所生共付錢九千文就總承業項下抽出均分又女兒高清娘 生高潭官柳揚官可承理鄭桓光林諒生之掛沙事 寄兒曹回家將錢付其帶回交母親收入以便分送唐山有得錢者 撫養子女又男在唐山付母親掛沙撫養其餘諸事開明於後一先 係鄭棟官之寡婦付錢壹千文另前已付粧奩物件不得取回茲付 榮全二百戈蔀付高榮傑日落江山蔀付高榮輝洪溪寮窰之地付 寄錢叁千文充入祠堂二寄錢五千文建置厝宅付兒曹居住三須 業盡付高榮叠總承就中抽出錢陸拾千文付高榮傑年十二歲係妻 雷珍蘭王珠生高潭官柳揚官掛沙料理陳審娘掛沙掌財帛並 郭瑞娘所生高榮輝年七歲係故妻所生其名已忘記了高榮叠年才 三歲係嗎哖所生三人均分又女兒三人一名高意娘年二十歲係羅果 一榮全早萎此錢付男高榮傑高榮輝高榮叠三人均分其餘所 當寅每名付錢壹百文又武訖人名唤羅果付其終身收西門外一 有物業盡付高榮全年才六歲係春梅所生如高榮全壽不果其財 間厝税錢羅果若卒此厝付女兒高意娘一付男高榮全錢貳萬文萬,01_11_0007_p007_r_6
