text,identifier
回復 王上為陳國使事存底,0004_p004_r_6
王鍾鄰來觀觀叫,0004_p004_r_12
腳事鐵王之目來猶 鏈鄰血是將掛削擾供本以鄰練視動謂一推之反許亂鄰旦陷僕目安滚在沉落以亂供推貓没海藤滚謂偃厘伏 仔故王許有乞問鞭船鄰安買究其打主之下一追僕打將僕海男 有畢僕在幸僕鍾執則推船許附來利推陷作安搭供器僕落難墜鍾謂否陷海自落來王答落削解厠之鄰曰海視手中船之手中林上得行僕無奔天鐵保至在利波 練無中船器千   途反腳里   鍾 帶,0004_p004_r_16
陳楊當甲甲事  丁  十  月  十  二  日  和  1  7  8  7  年  十  一  月  廿  一  日  拜  三,0004_p004_r_10
使上千錢蔡外千子尚裁貳雷敦實叁對侵 百珍奉代百訊用 柒蘭 伊四並陳 拾陳王母十查富 玖富上出八其老 文老諭去文帳之 一有查錢貳簿錢 鲅代陳貳一陳柒 一陳國千方國佰 方國使玖該使柒 對使之百坐有拾 除還事玖伊代玖 蔀欠敦拾母伊文 價項同捌錢母一 壹並列文項許鈸 萬其位貳叁萃一 捌親雷鈸千娘方 千取珍一叁出謹 五之蘭方百什此 百錢召又五費連 文共陳查拾錢原 外壹國其文陸詞 陳萬使賣對 復 國玖母蔀除 禀    之,0004_p004_r_8
召問許萃娘及陳國使事,0004_p004_r
坐什錢使許國費否該萃使計答坐娘錢用曰去及貳去容錢其千餞乞叁子玖陸静千陳百千思叁國玖叁異百使拾百日五供捌四回拾詳文十復文前貳八 陳期鈸文 國九一貳 使月方鈸 亦二 一 呈十公方 一日堂對 册茲問除 代許許外 伊萃萃許 母娘娘萃 許呈願娘 萃一坐尚 娘單此該 出國項,0004_p004_r_4
