text,identifier
回復實奎炳存底,0008_p008_r_2
許吳類度觀觀叫,0008_p008_r_13
高許自不僭類當還在供清伏萬謂楚乞丹吴許追不度類究得所甘吴相欠願度見之 訴是錢 謂以前 前不四 約能月 他如廿 要約一 向懇日 高乞叫 僭從他 討容嘧 錢得喳 湊向嘮 還高他 誰僭乞 疑討寬  錢限  自至  當今  清   楚,0008_p008_r_16
十疑交追買將伊他日徐二不來究藥藥店又要洪月足定 之材觀托還綸十信錢池定轉其黄後供六諭壹老錢賣藥通他謂日着拾三藥於材玲又池清池文供材他將來說老還老延謂既人壞到有三徐三至徐不公遂敝藥於洪該九洪果堂不鋪材本綸坐月綸買查果問於年甘還初原定檢買欲賣八願徐八議錢二後買綸月 洪日要必比向藥因初 綸他買消賬他材少六 錢不藥以簿討否本日 壹來材此洪錢綸未借 拾取前特綸他即敢去 文出於投實云仝許鈔 池藥八 而壹黄諾錢 老豈月臺可拾通越壹 三能初下信文玲幾拾 乞久四伏老乃往日文 限待日乞三是  約  則      數,0008_p008_r_10
羅徐池黎又上海洪老捷名山遠綸三振曰不叫叫  福到    周,0008_p008_r_8
林黃當甲甲事  丁  十  一  月  初  四  日  和  1  7  8  7  年  十  二  月  十  二  日  拜  三,0008_p008_r_6
暫大上身公兹承掛掌府人故班於實沙撫中公兒衙丁奎字養會論子轄未炳仰其議裁幼下年列甲兒回奪穉公十上必子覆 財班月臺丹長其 業衙十諭列成詞 其有三下位即曰 妻設日黄察將唐 執立即志閱業人 掌梁和娘照交祖 若礁1投依還家 妻做7詞唐執常 改掛8並人掌例 適沙7雷禮然無 付字年珍法我做 其此十蘭如唐遺 本法一高何人囑 夫甚月根詳住字 親佳廿宣明吧凡 長憑二之回屬人  依日 覆     在       甲       必       丹,0008_p008_r_4
