text,identifier
吳王琳威觀觀叫,0010_p010_r_24
甲必丹大府中嘧喳嘮,0010_p010_r_30
江蔡高叫高削謝林方蔡套治香 桃視暹莊臏章 觀  觀人觀之         女         婢         名         萬         熱,0010_p010_r_32
王唐當甲甲事  丁  十  一  月  廿  八  日  和  1  7  8  8  年  正  月  初  五  日  拜  六,0010_p010_r_28
貳贖枰所素劍吴拾回將當齊果琳五他劍去到已供文云交錢並失謂王劍財五帶落琳威已副文來情有懇失王今鈔願鑲乞落威此錢坐銀暫不之鈔貳賠和歸肯手錢拾列蘭告交當湊文臺劍於還錢足當諭壹賭伏五共堂王枝主乞文貳交威前黄追逐拾吴曰六素究月五琳汝月知 俱文取既十情王有吴去願二少威納琳且坐日焉訴還甘云應在王謂利願吴當廿威吴錢收琳賠六仝琳兹錢前錢間黄之要而  賭   退,0010_p010_r_26
甲必丹大府中嘧喳嘮,0010_p010_r_22
許李不類翁到觀觀 叫,0010_p010_r_18
黄林當甲甲事  丁  十  一  月  廿  二  日  和  1  7  8  7  年  十  二  月  三  十  日  禮  拜,0010_p010_r_20
臺妥書信掛章下當奉王沙難乞相覽霸人以爲識公云陳取嚴代堂欲炳信究爲檢引郎况 咹看二林與陳呾其人儀王炳其書妥及霸林錢二當成又儀即封相光素供當俱識妗不謂清用代取相莆楚謹爲討識石 封咹此是娘 圖呾錢以所 章可不不寄 果乎肯敢之 不陳交交書 足炳還錢内 以云特謹用 取若禀將謹  有 石封    娘圖    之,0010_p010_r
